{
  "$id": "https://www.rdmbench.com/schema/fixture-profile.json",
  "$schema": "https://json-schema.org/draft/2020-12/schema",
  "title": "RDMBench fixture profile",
  "description": "What a *model* is, captured from one unit of it: identity, product category and details, firmware, every DMX personality (name, footprint, E1.37-5 stable ID where the fixture has one), every sensor's definition, and the PIDs it lists — the file format under the library's `profiles/` directory and what `export-profile --out` writes. Harvested self-description: no values, no current state, no slot tables (reading those means switching the fixture's mode).",
  "type": "object",
  "properties": {
    "manufacturer": {
      "type": "string"
    },
    "manufacturer_id": {
      "description": "ESTA manufacturer ID — the top 16 bits of the brand's UIDs.",
      "$ref": "#/$defs/HexU16"
    },
    "model": {
      "description": "DEVICE_MODEL_DESCRIPTION, when the fixture has one.",
      "type": [
        "string",
        "null"
      ]
    },
    "model_id": {
      "description": "DEVICE_INFO's model ID. Manufacturer-assigned; unique within the\nbrand, and together with `manufacturer_id` the key of this file.",
      "$ref": "#/$defs/HexU16"
    },
    "personalities": {
      "description": "Every personality the fixture has, in number order. The current one\nis deliberately not recorded: that is the unit's state, not the\nmodel's.",
      "type": "array",
      "items": {
        "$ref": "#/$defs/PersonalityProfile"
      }
    },
    "product_category": {
      "description": "Table A-5 name of the product category, with its code.",
      "type": "string"
    },
    "product_category_id": {
      "$ref": "#/$defs/HexU16"
    },
    "product_details": {
      "description": "Table A-6 names from PRODUCT_DETAIL_ID_LIST; an unlisted code as\n`0xNNNN`.",
      "type": "array",
      "items": {
        "type": "string"
      }
    },
    "protocol_version": {
      "description": "RDM protocol version as `major.minor` (`1.0` for E1.20-2010).",
      "type": "string"
    },
    "quirks": {
      "description": "What this model is known to get **wrong** — see [`Quirk`]. Never\nwritten by [`capture_profile`]: the wire cannot show a fixture\nlying, so every entry is a curator's, added from a bench\nobservation with a method.",
      "type": "array",
      "items": {
        "$ref": "#/$defs/Quirk"
      }
    },
    "sensors": {
      "description": "Every sensor's definition, in number order — no values, for the\nsame reason.",
      "type": "array",
      "items": {
        "$ref": "#/$defs/SensorProfile"
      }
    },
    "software_version": {
      "type": [
        "string",
        "null"
      ]
    },
    "software_version_id": {
      "description": "The firmware this was read from. Personalities and sensors can\nchange between versions — a profile is only ever true of the\nfirmware that said it.",
      "$ref": "#/$defs/HexU32"
    },
    "source": {
      "description": "Where this came from: the unit, its firmware, the date. Required by\nthe sourcing rule, like a PID table's.",
      "type": [
        "string",
        "null"
      ]
    },
    "sub_device_count": {
      "type": "integer",
      "format": "uint16",
      "maximum": 65535,
      "minimum": 0
    },
    "supported_parameters": {
      "description": "What the fixture listed in SUPPORTED_PARAMETERS (or its enhanced\nform), so a reader can tell whether a model has a PID without a\nunit in front of them.",
      "type": "array",
      "items": {
        "$ref": "#/$defs/HexU16"
      }
    }
  },
  "required": [
    "manufacturer_id",
    "manufacturer",
    "model_id",
    "product_category",
    "product_category_id",
    "software_version_id",
    "protocol_version",
    "sub_device_count",
    "personalities",
    "sensors"
  ],
  "$defs": {
    "HeldLevel": {
      "description": "A level held on another channel of the same personality.",
      "type": "object",
      "properties": {
        "channel": {
          "description": "1 for the personality's first slot.",
          "type": "integer",
          "format": "uint16",
          "maximum": 65535,
          "minimum": 0
        },
        "value": {
          "type": "integer",
          "format": "uint8",
          "maximum": 255,
          "minimum": 0
        }
      },
      "required": [
        "channel",
        "value"
      ]
    },
    "HexU16": {
      "description": "16-bit value as `0xABCD` (a bare `ABCD` or a plain number is accepted on read).",
      "type": "string",
      "pattern": "^(0[xX])?[0-9A-Fa-f]{1,4}$"
    },
    "HexU32": {
      "description": "32-bit value as `0xABCD1234` (a bare `ABCD1234` or a plain number is accepted on read).",
      "type": "string",
      "pattern": "^(0[xX])?[0-9A-Fa-f]{1,8}$"
    },
    "LoadPlan": {
      "description": "The channels of one personality that a load test must hold at a level\nof their own rather than at full.\n\nThe case that filed it: an ADJ 5PX HEX in its 12-channel personality\nwith every slot at 255 lights **UV only**, because channel 9 is a\ncolour macro whose top value overrides the emitters (`docs/bench.md`,\n\"The load tool meets the 5PX\"). A tech reads that out of the manual;\nan assistant asked to drive the fixture has no manual, so the profile\ncarries it. A fact about the model rather than a fault in it, which is\nwhy it is not a [`Quirk`] — and a fact about one personality, since\nthe same channel number means something else in another.",
      "type": "object",
      "properties": {
        "slots": {
          "description": "Each channel, counted from the fixture's start address, and the\nlevel it is held at while the rest of the footprint is at full.",
          "type": "array",
          "items": {
            "$ref": "#/$defs/LoadSlot"
          }
        },
        "source": {
          "description": "Where this came from: the manual and page, and the bench run that\nconfirmed it. Required, as a quirk's is: a plan that is wrong\ndrives a fixture into the state the plan exists to avoid.",
          "type": "string"
        }
      },
      "required": [
        "slots",
        "source"
      ]
    },
    "LoadSlot": {
      "description": "One channel of a [`LoadPlan`].",
      "type": "object",
      "properties": {
        "channel": {
          "description": "1 for the personality's first slot.",
          "type": "integer",
          "format": "uint16",
          "maximum": 65535,
          "minimum": 0
        },
        "note": {
          "description": "What the channel is and why it is not at full — \"Colour macro:\n253–255 is UV only\". The curator's text, shown verbatim and never\ntranslated.",
          "type": [
            "string",
            "null"
          ]
        },
        "value": {
          "type": "integer",
          "format": "uint8",
          "maximum": 255,
          "minimum": 0
        }
      },
      "required": [
        "channel",
        "value"
      ]
    },
    "PersonalityProfile": {
      "description": "One DMX personality: name and footprint from DMX_PERSONALITY_DESCRIPTION,\nand the stable identifier from E1.37-5's DMX_PERSONALITY_ID where the\nfixture has it — the thing a desk profile can be matched against after\na firmware renumbers the list.",
      "type": "object",
      "properties": {
        "footprint": {
          "type": "integer",
          "format": "uint16",
          "maximum": 65535,
          "minimum": 0
        },
        "load": {
          "description": "How to drive this personality for a load test, where full on every\nslot is not output — see [`LoadPlan`]. Never written by\n[`capture_profile`]: nothing on the wire says which slot is a\ncolour macro, so every plan is a curator's, from the manual.",
          "anyOf": [
            {
              "$ref": "#/$defs/LoadPlan"
            },
            {
              "type": "null"
            }
          ]
        },
        "name": {
          "type": "string"
        },
        "number": {
          "description": "1-based, as the fixture numbers them.",
          "type": "integer",
          "format": "uint8",
          "maximum": 255,
          "minimum": 0
        },
        "personality_id": {
          "description": "`major.minor` in hex, or `user-defined` / `undefined`.",
          "type": [
            "string",
            "null"
          ]
        },
        "slots": {
          "description": "What each channel of this personality is, for a fixture that does\nnot say so itself — see [`SlotLayout`]. Never written by\n[`capture_profile`]; every layout is a curator's, from the manual.",
          "anyOf": [
            {
              "$ref": "#/$defs/SlotLayout"
            },
            {
              "type": "null"
            }
          ]
        }
      },
      "required": [
        "number",
        "name",
        "footprint"
      ]
    },
    "ProfileSlot": {
      "description": "One channel of a [`SlotLayout`].",
      "type": "object",
      "properties": {
        "by_eye": {
          "description": "`false` for a channel whose effect no held level shows, so a\nperson cannot judge it by eye: the channel walk rests it rather\nthan walking it, and says why. The 5PX's Dimmer Modes looked the\nsame in every mode under a held level (`docs/bench.md`) — a curve\nthat changes how a level fades, not where it sits. Absent is\n`true`, every other channel.",
          "type": "boolean"
        },
        "channel": {
          "description": "1 for the personality's first slot.",
          "type": "integer",
          "format": "uint16",
          "maximum": 65535,
          "minimum": 0
        },
        "name": {
          "description": "The manual's name for it — \"Master Dimmer\". Shown verbatim, never\ntranslated.",
          "type": "string"
        },
        "ranges": {
          "description": "What each band of values does, where the manual splits the channel\n— \"0–31 LED Off\". Empty for a plain 0–100 % channel.",
          "type": "array",
          "items": {
            "$ref": "#/$defs/SlotRange"
          }
        },
        "start": {
          "description": "The level to rest it at, as DEFAULT_SLOT_VALUE would give. Absent\nmeans not sent until set, as for a fixture that reports no default.",
          "type": [
            "integer",
            "null"
          ],
          "format": "uint8",
          "maximum": 255,
          "minimum": 0
        },
        "with": {
          "description": "What else to hold while this channel is walked, for a channel that\nonly changes light another one makes — a master dimmer, a strobe, a\ndimmer curve. On its own, with every emitter at rest, it shows\nnothing, and a tech fails a healthy channel (the 5PX's first walk,\n`docs/bench.md`). Not a walk plan: one list of levels, nothing else.",
          "type": "array",
          "items": {
            "$ref": "#/$defs/HeldLevel"
          }
        }
      },
      "required": [
        "channel",
        "name"
      ]
    },
    "Quirk": {
      "description": "One thing a model is known to get wrong, and how that was established.\n\nThis is the same subject as the rest of the profile — what a model is,\nkeyed on manufacturer and model ID — so it lives here rather than in a\nfourth dataset with its own loader and precedence rules. What a fixture\n*is* and what it *lies about* are both facts about the model, and both\nare only worth anything with a source attached.\n\nA quirk is never applied to a stored reading: see [`crate::quirks`].",
      "type": "object",
      "properties": {
        "check": {
          "description": "For [`QuirkKind::FailsCheck`], the behaviour check the model fails,\nby its stable id (one of [`crate::behaviour::CHECKS`]). No other\nkind carries one, and `validate-profiles` says so.",
          "type": [
            "string",
            "null"
          ]
        },
        "kind": {
          "$ref": "#/$defs/QuirkKind"
        },
        "source": {
          "description": "How it was established: the bench, the method, the date. Required —\nthe entry bar for a quirk is a documented observation, because a\nquirks table is otherwise where a project's own bugs go to hide.",
          "type": "string"
        }
      },
      "required": [
        "kind",
        "source"
      ]
    },
    "QuirkKind": {
      "description": "The quirks this build knows how to act on.\n\nDeliberately a short list. Each entry has to be something the bench can\n*do* something about — a reading it can annotate — not a note about the\nmodel, which is what a manual is for.",
      "anyOf": [
        {
          "description": "IDENTIFY_DEVICE (§10.11.1) reads backwards: the unit shows itself\nwhen the flag is `0` and rests when it is `1`. Invisible on the\nwire — the flag it reports is the flag it was given — so only a\nhuman watching the fixture can find it, and nothing but an entry\nhere can tell the bench.",
          "type": "string",
          "const": "identify-inverted"
        },
        {
          "description": "The model breaks one clause of E1.20 that the behaviour check\ntests, named by [`Quirk::check`]. Unlike an inverted identify this\n*is* visible on the wire — the check finds it every time — so the\nentry corrects nothing. What it changes is the page's sentence: a\nfailure every unit of the model has is not news about this unit,\nand a check that cannot say so is one a tech learns to skip.",
          "type": "string",
          "const": "fails-check"
        },
        {
          "description": "A kind written by a newer build than this one. Carried through\nunchanged so a round trip does not drop it, and acted on by\nnothing: a bench that cannot name a quirk must not guess at it.",
          "type": "string"
        }
      ]
    },
    "SensorProfile": {
      "description": "One sensor's definition, scaled into its unit (a value in `unit`, not\nthe raw i16), so a reader compares it with a report directly.",
      "type": "object",
      "properties": {
        "kind": {
          "description": "Table A-12 sensor type name.",
          "type": "string"
        },
        "name": {
          "type": "string"
        },
        "normal": {
          "type": "array",
          "maxItems": 2,
          "minItems": 2,
          "prefixItems": [
            {
              "type": "number",
              "format": "double"
            },
            {
              "type": "number",
              "format": "double"
            }
          ]
        },
        "number": {
          "description": "0-based, as the fixture numbers them.",
          "type": "integer",
          "format": "uint8",
          "maximum": 255,
          "minimum": 0
        },
        "range": {
          "description": "The limits the sensor can report, and the range it calls normal.",
          "type": "array",
          "maxItems": 2,
          "minItems": 2,
          "prefixItems": [
            {
              "type": "number",
              "format": "double"
            },
            {
              "type": "number",
              "format": "double"
            }
          ]
        },
        "records_lowest_highest": {
          "description": "Whether SENSOR_VALUE carries lowest / highest detected, and a\nRECORD_SENSORS value.",
          "type": "boolean"
        },
        "records_value": {
          "type": "boolean"
        },
        "unit": {
          "description": "Table A-13 unit symbol — `°C`, `V`, `%`. The range and normal\nlimits are scaled by the prefix, so it is not repeated here.",
          "type": "string"
        }
      },
      "required": [
        "number",
        "name",
        "kind",
        "unit",
        "range",
        "normal",
        "records_lowest_highest",
        "records_value"
      ]
    },
    "SlotLayout": {
      "description": "One personality's channels written down from the manual: in effect\nSLOT_INFO, SLOT_DESCRIPTION and DEFAULT_SLOT_VALUE for a fixture that\nimplements none of them.\n\nThe case that filed it: the ADJ 5PX HEX reports no slot table, and\n\"Send DMX…\" could only light it by a tech typing channel numbers out of\nthe manual — one channel is dark (master dimmer at 0) and one level is\nUV only (colour macro at full), `docs/bench.md`. Not the [`LoadPlan`]:\nthat answers what to drive in order to *measure*, this what each\nchannel *is* and where to rest it.",
      "type": "object",
      "properties": {
        "by_eye_source": {
          "description": "Who found that a slot cannot be judged by eye (`by_eye: false`),\nand how. Required as soon as one slot says so: it takes a channel\nout of the walk, and a manual never says what a person can see.",
          "type": [
            "string",
            "null"
          ]
        },
        "slots": {
          "description": "Every channel the manual names, in channel order.",
          "type": "array",
          "items": {
            "$ref": "#/$defs/ProfileSlot"
          }
        },
        "source": {
          "description": "Where the names and ranges came from: the manual and its page.\nRequired, as a load plan's is.",
          "type": "string"
        },
        "starts_source": {
          "description": "Who chose the `start` levels, and why. Required as soon as one slot\nhas a `start`, because a manual gives ranges, not defaults: a\nstarting level is the curator's choice, and the file has to say so\nrather than pass it off as the manufacturer's.",
          "type": [
            "string",
            "null"
          ]
        },
        "with_source": {
          "description": "Who chose the levels in each slot's `with`, and why. Required as\nsoon as one slot has a `with`, for the reason `starts_source` is:\nthe manual says what a channel does, not what to light it with.",
          "type": [
            "string",
            "null"
          ]
        }
      },
      "required": [
        "slots",
        "source"
      ]
    },
    "SlotRange": {
      "description": "A band of a [`ProfileSlot`]'s values and what it does.",
      "type": "object",
      "properties": {
        "from": {
          "type": "integer",
          "format": "uint8",
          "maximum": 255,
          "minimum": 0
        },
        "meaning": {
          "description": "The manual's words — \"LED Off\", \"Color64 (UV only)\". Verbatim.",
          "type": "string"
        },
        "to": {
          "type": "integer",
          "format": "uint8",
          "maximum": 255,
          "minimum": 0
        }
      },
      "required": [
        "from",
        "to",
        "meaning"
      ]
    }
  }
}
